index,name,synopsis,netflix,tiving
278,침수화원 : 꿈 속의 정원,연애 블로그를 운영하는 샤오샤오는 최면 심리 상담사 린선의 조수로 일하게 되고 심리적 문제를 겪는 사람들의 아픔을 치유하기 위해 사건의 진실을 찾아 나서는데…,0,1
279,와이 우먼 킬 시즌2,"‘위기의 주부들’, ‘은밀한 하녀들’을 제작한 마크 체리가 ‘와이 우먼 킬’ 시즌2로 돌아왔다. 새로운 출연진과 1949년을 배경으로 이야기를 이끌어 간다. 외면 뒤에 숨겨진 진정한 미의 의미와 진실을 탐구한다. 세상과 사회에서 무시 받는 한 여성이 사회에 나서는 여정.",0,1
280,고스트 닥터,"신들린 의술의 오만한 천재 의사와 사명감이라곤 1도 없는 황금 수저 레지던트, 배경도 실력도 극과 극인 두 의사가 바디를 공유하면서 벌어지는 메디컬 스토리",0,1
281,금의지하,"육선문의 여자 포쾌 원금하 (담송운)는 한 사건으로 인해 인정사정없는 금의위 육역 (임가륜)과 엮이게 된다. 조정의 돈 십만 냥이 없어지는 사건이 발생하고, 원금하는 육역과 같이 사건을 조사하라는 명을 받는다. 더이상 그와 엮이지 않을 줄 알았던 원금하와 육역은 힘을 합치게 되고 운명의 수레도 굴러가기 시작하는데... 그러나 일은 항상 뜻대로 되지 않는 법. 두 사람의 가문은 피가 서린 원수 사이였는데…",0,1
282,CSI 라스베가스,25년 경력의 베테랑 길 그리썸을 반장으로 한 과학수사대 요원들이 환락과 도박의 도시 라스베가스를 위협하는 각종 범죄현장들을 다니며 과학적인 방법으로 증거를 채취하고 사건을 해결하는 드라마.,0,1
283,아적소확행,꿈을 이루기 위해 엄마 몰래 귀국해 로펌에 취직한 충룽은 파견 나간 병원에서 신경외과 의사 원사오칭과 사사건건 부딪친다. 어린 시절 뚱뚱했던 자신을 지켜준 소녀를 기다리던 원사오칭은 충룽이 그 소녀인 걸 알게 되는데...,0,1
284,시카고 타자기,"tvN 금토드라마 <시카고 타자기＞ 주연: 유아인, 임수정, 고경표 줄거리: 슬럼프에 빠진 베스트셀러 작가 세주와 그의 이름 뒤에 숨은 유령 작가 진오, 한 때 세주의 열혈 팬에서 안티 팬으로 돌변한 문인 덕후 전설, 그리고 의문의 오래된 ′타자기′와 얽힌 세 남녀의 낭만적인 미스터리와 앤티크 로맨스의 만남",0,1
285,모범형사,진실에 다가가려는 자와 은폐하려는 자들 간의 대결을 담은 리얼한 형사들의 세계를 그린 드라마,1,1
286,슬기로운 의사생활,"누군가는 태어나고 누군가는 삶을 끝내는 인생의 축소판이라 불리는 병원에서, 평범한 듯 특별한 하루하루를 살아가는 사람들과 눈빛만 봐도 알 수 있는 20년지기 친구들의 케미스토리를 담은 드라마",1,1
287,멜로가 체질,가짜 뉴스가 범람하는 세상에서 오직 팩트를 통해 진실을 밝히고자 하는 탐사보도팀 ′아르곤′의 치열한 삶을 그려낸 드라마,1,1
288,나의 아저씨,"사라진 신부를 찾기 위해, 괴물이 된 남자.",1,1
289,갯마을 차차차,"현실주의 치과의사 윤혜진과 만능 백수 홍반장이 짠내 사람내음 가득한 바닷마을 ‘공진’에서 벌이는 티키타카 힐링 로맨스 대도시 생활을 접은 치과의사가 바닷가 마을에서 병원을 개업한다. 끈끈하기 그지없는 이 동네, 그곳에서 만난 만능 백수 히어로. 모든 면에서 그녀와 정반대를 달리는데, 은근히 매력이 넘친다?",1,1
290,빈센조,"조직의 배신으로 한국으로 오게 된 이탈리아 마피아 변호사가 베테랑 독종 변호사와 함께 악당의 방식으로 악당을 쓸어버리는 이야기 악은 악으로, 약은 약으로! 모국을 찾은 한국계 이탈리아 마피아 변호사. 무소불위의 재벌에 쓴맛 한번 보여줄까? 이거 본의 아니게 정의의 사도가 될지도 모르겠네.",1,1
291,스물다섯 스물하나,"1998년, 시대에게 꿈을 빼앗긴 청춘들의 방황과 성장을 그린 청량로맨스, 꿈은 그저 꿈으로만 남을 것 같던 그 시절. 야심 찬 목표를 향해 달려가던 고등학교 펜싱선수가 무너진 삶을 다시 세우려 억척스럽게 살아가는 청년을 만난다.",1,1
292,이번 생은 처음이라,집 있는 달팽이가 세상 제일 부러운 ′홈리스′ 윤지호와 현관만 내 집인 ′하우스푸어′ 집주인 남세희가 한집에 살면서 펼쳐지는 수지타산 로맨스.,1,1
293,비밀의 숲,"감정을 느끼지 못하는 외톨이 검사 황시목이, 정의롭고 따뜻한 형사 한여진과 함께 검찰 스폰서 살인사건과 그 이면에 숨겨진 진실을 파헤치는 내부 비밀 추적극!",1,1
294,이태원 클라쓰,"불합리한 세상 속, 고집과 객기로 뭉친 청춘들의 ′힙′한 반란이 시작된다. 세계를 압축해 놓은 듯한 이태원. 이 작은 거리, 각자의 가치관으로 자유를 쫓는 그들의 창업 신화",1,1
295,시그널,tvN 10주년 특별기획<시그널> ′우리의 시간은 이어져있다.′과거로부터 걸려온 간절한 신호(무전)로 연결된 현재와 과거의 형사들이 오래된 미제 사건들을 다시 파헤친다!,1,1
296,뷰티 인사이드,한 달에 일주일 타인의 얼굴로 살아가는 여자와 일 년 열두 달 타인의 얼굴을 알아보지 못하는 남자의 조금은 특별한 로맨스를 그린 드라마,1,1
297,보이스,′112 신고센터 골든타임팀′으로 한 팀을 이룬 ′소리를 쫓는′ 괴물형사 장혁과 ′소리를 보는′ 보이스프로파일러 이하나가 범죄 현장의 골든타임을 사수하는 리얼타임 소리추격극,1,1
298,"알고있지만,",사랑은 못 믿어도 연애는 하고 싶은 여자 유나비와 연애는 성가셔도 썸은 타고 싶은 남자 박재언의 로맨스를 그린 드라마,1,1
299,경이로운 소문,"악귀 사냥꾼 ′카운터′들이 국수집 직원으로 위장해, 지상의 악귀들을 물리치는 통쾌하고 땀내나는 악귀타파 히어로물",1,1
300,미생,"바둑이 인생의 모든 것이었던 장그래가 프로입단에 실패한 후, 냉혹한 현실에 던져지면서 벌어지는 이야기를 그린 드라마",1,1
301,로맨스는 별책부록,"′책을 만들었는데, 로맨스가 따라왔다?′ 책을 읽지 않는 세상에서 책을 만드는 사람들의 이야기를 담은 로맨틱 코미디 드라마",1,1
302,백일의 낭군님,완전무결 왕세자에서 졸지에 무쓸모남으로 전락한 원득과 조선 최고령 원녀 홍심의 전대미문 100일 로맨스 사극,1,1
303,"서른, 아홉","마흔을 코앞에 둔 세 친구의 우정과 사랑, 삶에 대한 깊이 있는 이야기를 다루는 현실 휴먼 로맨스 드라마",1,1
304,아는 와이프,한 번의 선택으로 달라진 현재를 살게 된 운명적인 러브스토리를 그린 드라마,1,1
305,기상청 사람들: 사내연애 잔혹사 편,열대야보다 뜨겁고 국지성 호우보다 종잡을 수 없는 기상청 사람들의 일과 사랑을 그린 직장 로맨스 드라마,1,1
306,명불허전,침을 든 조선 최고의 한의사 허임(김남길)과 메스를 든 현대 의학 신봉자 외과의 최연경(김아중)이 400년을 뛰어넘어 펼치는 조선왕복 메디활극,1,1
307,디어 마이 프렌즈,′′끝나지 않았다. 여전히 살아있다′′고 외치는 ′황혼 청춘′들의 인생 찬가를 그린 드라마 연출: 홍종찬 / 극본: 노희경 꼰대찬가 <디어 마이 프렌즈>,1,1
308,SKY 캐슬,"대한민국 상위 0.1%가 모여 사는 SKY 캐슬 안에서 남편은 왕으로, 제 자식은 천하제일 왕자와 공주로 키우고 싶은 명문가 출신 사모님들의 처절한 욕망을 샅샅이 들여다보는 리얼 코믹 풍자 드라마",1,1
309,어비스,′′영혼 소생 구슬′′ 어비스를 통해 생전과 180도 다른 ′반전 비주얼′로 부활한 두 남녀가 자신을 죽인 살인자를 쫓는 반전 비주얼 판타지,1,1
310,손 the guest,"한국 사회 곳곳에서 기이한 힘에 의해 벌어지는 범죄에 맞서는 영매와 사제, 형사의 이야기를 그린 한국형 리얼 엑소시즘",1,1
311,열여덟의 순간,위태롭고 미숙한 ′Pre-청춘′들의 세상을 있는 그대로 들여다보는 감성 청춘 드라마,1,1
312,남자친구,한 번도 자신이 선택한 삶을 살아보지 못한 수현과 자유롭고 맑은 영혼 진혁의 우연한 만남으로 시작된 설레는 감성멜로 드라마.,1,1
